{
  "status": "success",
  "founders": [
    {
      "name": "Corvin Binder",
      "linkedin_url": "https://www.linkedin.com/in/corvinbinder/",
      "role_in_company": "Co-Founder and CEO",
      "background_summary": "Corvin Binder is the Co-Founder and CEO of Aegis Blue, a company focused on managing AI-driven business risks associated with large language models (LLMs). He holds both M.Sc. and B.Sc. degrees in Mathematics from the University of Augsburg. Prior to founding Aegis Blue, Corvin worked as a Management Consultant at Confexx GmbH for nearly five years, specializing in strategic consulting, operational improvement, process optimization, and technology implementation. At Aegis Blue, he oversees strategic direction and operational excellence, with a collaborative, precise, and pragmatic leadership style. His work is centered on providing practical solutions like AI risk assessments, red-teaming, and continuous monitoring to mitigate risks such as data leaks, IP theft, and compliance failures.",
      "previous_companies": [
        {
          "company_name": "Aegis Blue",
          "role": "Co-Founder and CEO",
          "duration": "1 yr 2 mos",
          "description": "Leads strategic direction and operational excellence for a company focused on AI risk management, providing solutions such as AI risk assessments, red-teaming, and continuous monitoring.",
          "was_founder": true
        },
        {
          "company_name": "Confexx GmbH",
          "role": "Management Consultant",
          "duration": "4 yrs 10 mos",
          "description": "Specialized in strategic consulting, operational improvement, process optimization, and technology implementation for various clients.",
          "was_founder": false
        }
      ],
      "education": [
        {
          "institution": "University of Augsburg",
          "degree": "M.Sc.",
          "field_of_study": "Mathematics",
          "graduation_year": null,
          "notable_achievements": null
        },
        {
          "institution": "University of Augsburg",
          "degree": "B.Sc.",
          "field_of_study": "Mathematics",
          "graduation_year": null,
          "notable_achievements": null
        }
      ],
      "key_skills_and_expertise": [
        "AI risk management",
        "Strategic consulting",
        "Operational improvement",
        "Process optimization",
        "Technology implementation",
        "Mathematical analysis",
        "Leadership"
      ],
      "public_speaking_or_content": null,
      "investment_criteria_assessment": {
        "focus_industry_fit": true,
        "mission_alignment": true,
        "exciting_solution_to_problem": true,
        "founded_something_relevant_before": false,
        "impressive_relevant_past_experience": false,
        "exceptionally_smart_or_strategic": true,
        "assessment_summary": "Corvin Binder is a technically strong founder with a clear focus on AI risk management, a highly relevant and timely problem in the tech industry. His academic background in mathematics and experience in management consulting demonstrate strong analytical and strategic skills. While Aegis Blue is his first founded company and he lacks experience at major global brands, his current venture is well-aligned with impact-driven and responsible innovation. There is limited evidence of public thought leadership or content, but his expertise and leadership in a critical tech sector are clear positives."
      }
    }
  ],
  "founder_count": 1,
  "timestamp": "2025-06-17T18:04:37.708283"
}